"Article_text_name","Article_heading","Article_data"
"На место происшествия приехали спасатели. После начала разбора завалов крыша попавшего под обстрел дома обрушилась на спасателей.","Обрушение жилого дома в Белгороде после обстрела. Главное","12 мая, 15:56"
"Обрушение затронуло десять этажей в подъезде дома, всего пострадали 40 квартир, сказал глава администрации Белгорода Валентин Демидов. Он добавил, что спасатели с помощью автовышки эвакуировали из квартир людей, которые оказались заблокированными из-за разрушения лестницы и лифта.","Обрушение жилого дома в Белгороде после обстрела. Главное","12 мая, 15:56"
"Хоккеисты сборной Финляндии одержали крупную победу над командой Великобритании на проходящем в Чехии чемпионате мира.","Сборная Финляндии разгромила британцев со счетом 8:0 на ЧМ по хоккею","12 мая, 15:40"
"Матч в Праге завершился со счетом 6:0 (1:0, 5:0, 2:0).","Сборная Финляндии разгромила британцев со счетом 8:0 на ЧМ по хоккею","12 мая, 15:40"
"Хет-трик на счету Оливера Капанена, Микаэль Гранлунд и Ахти Оксанен сделали по четыре результативные передачи.","Сборная Финляндии разгромила британцев со счетом 8:0 на ЧМ по хоккею","12 мая, 15:40"
"Британцы потерпели второе поражение подряд и замыкают турнирную таблицу группы А.","Сборная Финляндии разгромила британцев со счетом 8:0 на ЧМ по хоккею","12 мая, 15:40"
"В следующем матче турнира финны сыграют с норвежцами 13 мая, а британцы — со швейцарцами 15 мая.","Сборная Финляндии разгромила британцев со счетом 8:0 на ЧМ по хоккею","12 мая, 15:40"
"Сборная России пропускает третий чемпионат мира подряд из-за отстранения.","Сборная Финляндии разгромила британцев со счетом 8:0 на ЧМ по хоккею","12 мая, 15:40"
"Правительство представит предложения по системе плавного перехода с упрощенной системы налогообложения (УСН) на общую систему налогообложения (ОСНО) до 30 мая. Об этом сообщил вице-спикер от партии «Новые люди» Владислав Даванков по итогам заседания комитета Госдумы, где утверждалась кандидатура Антона Силуанова на пост главы Минфина, передает корреспондент РБК.","В Думе назвали срок подготовки предложений по налогообложению для бизнеса","12 мая, 15:34"
"«Это хорошая новость для всех предпринимателей. Все помнят громкие дела о задержаниях предпринимателей за дробление бизнеса. Но в ряде случаев к дроблению подталкивает сама налоговая система», — заявил Даванков.","В Думе назвали срок подготовки предложений по налогообложению для бизнеса","12 мая, 15:34"
"По его словам, правительство понимает, что «невозможно перейти с УСН на общую систему при росте выручки и при этом сохранить прибыль», и идет навстречу. «Мы рассматриваем это в том числе как шаг к понятному порядку амнистии за дробление бизнеса», — добавил Даванков.","В Думе назвали срок подготовки предложений по налогообложению для бизнеса","12 мая, 15:34"
"В послании Федеральному собранию 29 февраля президент Владимир Путин попросил правительство и Госдуму «проработать параметры амнистии в отношении некрупных компаний, которые при фактическом росте бизнеса были вынуждены использовать схемы налоговой оптимизации», — иными словами, схемы искусственного дробления бизнеса.","В Думе назвали срок подготовки предложений по налогообложению для бизнеса","12 мая, 15:34"
"Для компаний не должно быть пересчета налогов и штрафов, отметил Путин. Он рассказал, что будет также рассмотрена возможность плавного изменения налоговой нагрузки при переходе компаний с «упрощенки».","В Думе назвали срок подготовки предложений по налогообложению для бизнеса","12 мая, 15:34"
"К 2026 году в России более чем в тысяче вузов будет внедрена новая модель высшего образования, сообщил и.о. вице-премьера Дмитрий Чернышенко на заседании комитета Госдумы по науке и высшему образованию, передает ТАСС. На нем поддержали кандидатуру Чернышенко на пост зампреда правительства.","Власти заявили о плане расширить новую модель образования на тысячу вузов","12 мая, 15:23"
"«Мы с вами вместе работаем по поручению президента над формированием новой модели высшего образования. С 2026 года планируется ее полномасштабное внедрение более чем в тысяче вузов страны», — сказал он.","Власти заявили о плане расширить новую модель образования на тысячу вузов","12 мая, 15:23"
"В мае 2022-го министр науки и высшего образования Валерий Фальков объявил о намерении России отказаться от Болонской системы высшего образования и разработать «собственную уникальную».","Власти заявили о плане расширить новую модель образования на тысячу вузов","12 мая, 15:23"
"Год спустя президент Владимир Путин подписал указ о реализации в учебном году 2023/24 пилотного проекта с новыми уровнями высшего образования.","Власти заявили о плане расширить новую модель образования на тысячу вузов","12 мая, 15:23"
"Он предполагает два уровня: базовый (срок освоения — четыре-шесть лет) и специализированный (магистратура — один-три года, ординатура, ассистентура-стажировка). Аспирантура отнесена к профессиональному образованию.","Власти заявили о плане расширить новую модель образования на тысячу вузов","12 мая, 15:23"
"Для реализации пилотного проекта выбрали шесть вузов: Балтийский федеральный университет им. Иммануила Канта, Московский авиационный институт (НИУ МАИ), Национальный исследовательский технологический университет МИСиС, Московский педагогический государственный университет, Санкт-Петербургский горный университет, Томский государственный университет.","Власти заявили о плане расширить новую модель образования на тысячу вузов","12 мая, 15:23"
"По словам Чернышенко, в рамках новой системы уже разработаны 180 новых образовательных программ, на обучение по ним в прошлом году приняли свыше 4 тыс. студентов.","Власти заявили о плане расширить новую модель образования на тысячу вузов","12 мая, 15:23"
"Министерство спорта в случае назначения его главой Михаила Дегтярева займется развитием массового спорта, в числе приоритетов будут также зрелищность внутрироссийских соревнований и отмена платы для людей при занятии спортом, сообщил губернатор Хабаровского края на заседании профильного комитета Госдумы, передает корреспондент РБК.","Дегтярев рассказал, чем займется на посту главы Минспорта","12 мая, 15:23"
"«С учетом нынешнего положения дел основной акцент будем делать на развитии массового спорта как основы здоровья, вовлечения людей в проактивность. Детско-юношеский спорт, здесь вопрос доступности встает, мы уделим этому отдельное внимание. В регионах есть вопросы... В первую очередь — бесплатность занятия спортом для детей», — рассказал Дегтярев.","Дегтярев рассказал, чем займется на посту главы Минспорта","12 мая, 15:23"
"Кандидат на пост министра назвал «безобразием» существование стартовых взносов и других платежей при участии спортсменов в соревнованиях. «Я считаю, государство должно брать это на себя и исходя из этого одна из наших задач — внимательно посмотреть календарный план, выделить базовые соревнования и полностью взять на обеспечение государства. Никаких стартовых взносов, никаких других платежей», — сказал он.","Дегтярев рассказал, чем займется на посту главы Минспорта","12 мая, 15:23"
"Важнейшим вопросом он назвал «зрелищность внутренних соревнований». Он отметил, что «если правильно подойти к маркетингу», то на соревнованиях внутри России получится зарабатывать, и в качестве примера привел рост доходов хоккейного клуба «Амур» из Хабаровского края. «Конечно, мы хотим, чтобы наши внутренние соревнования по кассе, по аудитории обгоняли многие международные», — подчеркнул он.","Дегтярев рассказал, чем займется на посту главы Минспорта","12 мая, 15:23"
"Еще один вопрос, озвученный кандидатом в министры, — лицензирование физкультурно-оздоровительных услуг. «Их оказывают не только государственные и муниципальные учреждения, иногда это частные организации. Вскрываются факты не очень квалифицированных кадров, которые вместо здоровья могут нанести [вред]. Будем с Думой обсуждать. Вопрос лицензирования и аккредитации таких организаций, я думаю, тоже может встать», — заметил Дегтярев.","Дегтярев рассказал, чем займется на посту главы Минспорта","12 мая, 15:23"
"Дегтярев дважды избирался депутатом Госдумы от ЛДПР (2011–2020 годы, VI и VII созывы), где возглавлял комитет по физической культуре, спорту, туризму и делам молодежи. В 2020 году депутатские полномочия Дегтярева были прекращены досрочно — он стал исполняющим обязанности главы Хабаровского края во время массовых протестов, спровоцированных арестом губернатора Сергея Фургала (также члена ЛДПР).","Дегтярев рассказал, чем займется на посту главы Минспорта","12 мая, 15:23"
"В России число женщин репродуктивного возраста будет снижаться. Об этом заявила и.о. вице-премьера Татьяна Голикова на заседании профильного комитета, передает ТАСС.","Голикова анонсировала снижение числа женщин репродуктивного возраста","12 мая, 15:09"
"«Количество женщин, которые находятся в репродуктивном возрасте, существенно снизилось, тенденция по снижению будет еще достаточно длительное время наблюдаться, хотя возраста 20–29 лет начнут прирастать после 2028 года», — сказала она.","Голикова анонсировала снижение числа женщин репродуктивного возраста","12 мая, 15:09"
"Голикова заявила о важности выработки мер, направленных на перелом существующих репродуктивных установок, так как «женщины принимают решение о рождении первого ребенка уже в более позднем возрасте».","Голикова анонсировала снижение числа женщин репродуктивного возраста","12 мая, 15:09"
"И.о. вице-премьера напомнила, что президент Владимир Путин поставил задачу увеличить суммарный коэффициент рождаемости (число детей, рожденных одной женщиной на протяжении всего репродуктивного периода) в России до 1,6 к 2030 году и до 1,8 к 2036 году, а также достичь ежегодного роста суммарного коэффициента рождаемости третьих и последующих детей. Максимума за новейшую историю страны коэффициент достигал в 2015 году — 1,78.","Голикова анонсировала снижение числа женщин репродуктивного возраста","12 мая, 15:09"
"Согласно информации Росстата, по итогам 2023 года суммарный коэффициент рождаемости в России составил 1,41. По сравнению с 2022 годом (1,42) показатель снизился незначительно, но стал минимальным за 17 лет. В последний раз более низкий коэффициент рождаемости фиксировался в 2006 году (1,31). При этом число третьих и последующих детей в расчете на одну женщину выросло.","Голикова анонсировала снижение числа женщин репродуктивного возраста","12 мая, 15:09"
"Голикова подчеркнула, что в 2023 году удалось остановить тренд, который связан со снижением коэффициента рождаемости по первым детям. При этом по вторым детям рождаемость снизилась на 4,5%, а по третьим детям выросла на 3,6%, уточнила она.","Голикова анонсировала снижение числа женщин репродуктивного возраста","12 мая, 15:09"
"11 мая и.о. премьер-министра Михаил Мишустин внес на рассмотрение Госдумы новый состав правительства. Предполагается, что Голикова продолжит курировать деятельность Минздрава, Минтруда и Минкульта. В ее сферу ведения войдет Федеральное агентство по делам национальностей (в прежнем составе оно находилось в сфере и.о. вице-премьера Дмитрия Чернышенко).","Голикова анонсировала снижение числа женщин репродуктивного возраста","12 мая, 15:09"
"Возглавляющего «Шанхай Шэньхуа» Леонида Слуцкого признали лучшим тренером апреля в чемпионате Китая, сообщается на странице турнира в Weibo.","Слуцкого второй раз подряд признали лучшим тренером месяца в Китае","12 мая, 15:06"
"В пяти матчах апреля «Шэньхуа» одержал три победы и дважды сыграл вничью.","Слуцкого второй раз подряд признали лучшим тренером месяца в Китае","12 мая, 15:06"
"Клуб Слуцкого еще ни разу не проиграл с начала чемпионата (11 матчей) и возглавляет турнирную таблицу.","Слуцкого второй раз подряд признали лучшим тренером месяца в Китае","12 мая, 15:06"
"Бывший главный тренер сборной России возглавил китайский клуб с начала года и выиграл с ним Суперкубок, победив действующего чемпиона «Шанхай Порт».","Слуцкого второй раз подряд признали лучшим тренером месяца в Китае","12 мая, 15:06"
"В марте Слуцкий также был признан лучшим тренером турнира.","Слуцкого второй раз подряд признали лучшим тренером месяца в Китае","12 мая, 15:06"