"Article_text_name","Article_heading","Article_data"
"Комитет Госдумы по развитию Дальнего Востока и Арктики поддержал кандидатуры Юрия Трутнева на должность заместителя председателя правительства — полномочного представителя президента в ДФО — и Алексея Чекункова на пост министра по развитию Дальнего Востока и Арктики и рекомендовал их Госдуме для утверждения. Об этом сообщили РБК в пресс-службе вице-премьера.","Комитет Госдумы поддержал кандидатуры Трутнева и Чекункова","12 мая, 16:37"
"«Решение комитета принято единогласно», — заявил председатель комитета Госдумы Николай Харитонов. Заместитель председателя, вице-спикер Госдумы Ирина Яровая добавила, что Трутнев и Чекунков «всем делом своей жизни подтвердили, что нет задач формальных, все задачи сущностные».","Комитет Госдумы поддержал кандидатуры Трутнева и Чекункова","12 мая, 16:37"
"Чекунков, выступая на заседании комитета, заявил, что главная задача — это обеспечить жителям Дальнего Востока «комфортную, счастливую и интересную жизнь в условиях, когда объективные параметры жизни, климатические, инфраструктурные, уровень цен не всегда выгодно сравнимы с условиями жизни в европейской России». Трутнев сказал, что постарается «добиться лучших результатов в самое ближайшее время».","Комитет Госдумы поддержал кандидатуры Трутнева и Чекункова","12 мая, 16:37"
"Трутнев — полпред президента в Дальневосточном федеральном округе, бывший губернатор Пермской области и экс-министр природных ресурсов России. С 2013 года занимает пост вице-премьера.","Комитет Госдумы поддержал кандидатуры Трутнева и Чекункова","12 мая, 16:37"
"Чекунков — министр по развитию Дальнего Востока и Арктики. С февраля 2015 года входит в состав Правительственной комиссии по вопросам социально-экономического развития Дальнего Востока.","Комитет Госдумы поддержал кандидатуры Трутнева и Чекункова","12 мая, 16:37"
"Во время сигнала о ракетной опасности в Белгороде прозвучали новые взрывы, сообщают ТАСС и «РИА Новости» со ссылкой на корреспондентов.","В Белгороде раздались новые взрывы","12 мая, 16:35"
"В очередной раз сирена ракетной опасности прозвучала в Белгороде и Белгородском районе в 16:03 мск. До этого, с начала суток, тревога объявлялась в городе по меньшей мере шесть раз.","В Белгороде раздались новые взрывы","12 мая, 16:35"
"Днем после очередного обстрела Белгорода фрагмент сбитой ракеты комплекса «Точка-У» упал на жилой дом в районе «Харьковская гора». В результате обрушился подъезд жилого дома от первого до десятого этажа. Позже, во время проведения спасательных работ, обрушилась и кровля здания.","В Белгороде раздались новые взрывы","12 мая, 16:35"
"По последним данным, пострадали около 20 человек, информации о погибших нет. На месте обрушения продолжаются работы. В МЧС сообщали, что спасательную операцию приходилось несколько раз прерывать из-за объявлявшихся воздушных тревог.","В Белгороде раздались новые взрывы","12 мая, 16:35"
"Публичное обсуждение подходов к изменениям налоговой системы начнется 20 мая на экспертном совете комитета Госдумы по бюджету и налогам, сообщил председатель комитета Андрей Макаров, передает корреспондент РБК. Внесение предложений запланировано на весеннюю сессию.","В Думе назвали срок начала обсуждения изменений в налоговой системе","12 мая, 16:32"
"Президент Владимир Путин в послании Федеральному собранию 29 февраля попросил правительство и Госдуму «проработать параметры амнистии в отношении некрупных компаний, которые при фактическом росте бизнеса были вынуждены использовать схемы налоговой оптимизации» — то есть схемы искусственного дробления бизнеса.","В Думе назвали срок начала обсуждения изменений в налоговой системе","12 мая, 16:32"
"Глава государства подчеркнул, что для компаний не должно быть пересчета налогов и штрафов. Будет рассмотрена и возможность плавного изменения налоговой нагрузки при переходе компаний с упрощенной системы, говорил Путин.","В Думе назвали срок начала обсуждения изменений в налоговой системе","12 мая, 16:32"
"Вице-спикер от партии «Новые люди» Владислав Даванков заявил, что правительство представит предложения по системе плавного перехода с упрощенной системы налогообложения (УСН) на общую систему налогообложения (ОСНО) до 30 мая.","В Думе назвали срок начала обсуждения изменений в налоговой системе","12 мая, 16:32"
"В послании Федеральному собранию Путин также призывал обеспечить «более справедливое распределение налогового бремени в сторону тех, у кого более высокие личные и корпоративные доходы». Пресс-секретарь президента России Дмитрий Песков объяснил, что Путин считает справедливыми изменения налоговой системы, после которых те граждане, которые получают меньше, будут платить налоги по более низкой ставке, чем более обеспеченные россияне.","В Думе назвали срок начала обсуждения изменений в налоговой системе","12 мая, 16:32"
"В России прогрессивная шкала НДФЛ существовала в 1992–2001 годах. Минимальная ставка составляла 12%, максимальная — 35%. Затем была введена плоская шкала с общей ставкой 13%. В 2021 году в ней появился элемент прогрессии. Так, для россиян с доходами менее 5 млн руб. в год ставка осталась на прежнем уровне — 13%, но доходы сверх этого уровня стали облагаться по ставке 15%.","В Думе назвали срок начала обсуждения изменений в налоговой системе","12 мая, 16:32"
"Чемпион России, бывший главный тренер национальной сборной и двукратный участник Олимпиад Игорь Сысоев погиб в воскресенье в автоаварии, сообщила пресс-служба Федерации триатлона России.","Первый российский триатлонист на Олимпийских играх погиб в ДТП в 43 года","12 мая, 16:24"
"Сысоеву было 43 года.","Первый российский триатлонист на Олимпийских играх погиб в ДТП в 43 года","12 мая, 16:24"
"Сысоев — обладатель Кубка Европы по триатлону, основатель системы спортивной подготовки «ЦиклON», первый представитель отечественного мужского триатлона, завоевавший право выступить на Олимпиаде и вошедший в топ-5 на чемпионатах мира на олимпийской дистанции.","Первый российский триатлонист на Олимпийских играх погиб в ДТП в 43 года","12 мая, 16:24"
"Сысоев выступал за сборную в 2000-2009 годах, а в 2017-2020 годах был главным тренером команды.","Первый российский триатлонист на Олимпийских играх погиб в ДТП в 43 года","12 мая, 16:24"
"Триатлон вошел в программу Олимпиад в Сиднее в 2000 году. В 2004-м Сысоев показал на Играх 15-й результат, а в 2008-м стал девятым.","Первый российский триатлонист на Олимпийских играх погиб в ДТП в 43 года","12 мая, 16:24"
"Пресс-служба ГУ МВД по Краснодарскому краю сообщила, что в воскресенье в Темрюкском районе 43-летний водитель Voyah нарушил ПДД и выехал на встречную полосу, где столкнулся с грузовиком. Водитель внедорожника скончался на месте от полученных травм до приезда скорой, пассажирку легковушки госпитализировали.","Первый российский триатлонист на Олимпийских играх погиб в ДТП в 43 года","12 мая, 16:24"
"Комитет Госдумы по культуре поддержал кандидатуру Ольги Любимовой на пост министра культуры в новом правительстве России, говорится в поступившем в РБК сообщении министерства.","Комитет Думы поддержал кандидатуру Любимовой на пост главы Минкультуры","12 мая, 16:18"
"Любимова, которая возглавляет ведомство с 2020 года, на заседании комитета отчиталась о деятельности своего ведомства в последние годы и его планах. По ее словам, особое внимание уделят задачам, поставленным президентом Владимиром Путиным в послании Федеральному собранию и различных нормативных актах последнего времени.","Комитет Думы поддержал кандидатуру Любимовой на пост главы Минкультуры","12 мая, 16:18"
"В следующем году запустят программу «Земский работник культуры», чтобы закрыть потребность регионов в работниках культуры в малых населенных пунктах (сейчас она составляет 16 275 человек). Также будет проработана программа сохранения объектов культурного наследия народов России, сказано в сообщении.","Комитет Думы поддержал кандидатуру Любимовой на пост главы Минкультуры","12 мая, 16:18"
"До того как стать министром культуры, Любимова более 20 лет проработала в тележурналистике, в том числе была ведущей и продюсером на каналах ТВЦ, «Культура» и др., работала замглавы дирекции социальных и публицистических программ «Первого канала». В 2015 году заняла должность советника руководителя департамента кинематографии Минкультуры, которая была создана специально для нее, а в 2018-м возглавила сам департамент вместо ушедшего в Госфильмофонд Вячеслава Тельнова.","Комитет Думы поддержал кандидатуру Любимовой на пост главы Минкультуры","12 мая, 16:18"
"В 2023 году при Любимовой состоялось два знаковых события в музейной отрасли: РПЦ были переданы рака Александра Невского, прежде хранившаяся в «Эрмитаже» и «Троица» Андрея Рублева, которая раньше выставлялась в Третьяковской галерее.","Комитет Думы поддержал кандидатуру Любимовой на пост главы Минкультуры","12 мая, 16:18"
"За годы управления Любимовой Минкультуры оказалось в центре ряда резонансных событий в сфере кинематографа. Так, министерство многократно отказывало в выдаче прокатных удостоверений ожидаемым фильмам, например «Министерству неджентльменских дел» Гая Ричи, «Брату 3», «Искушению» Пола Верховена, сериалу «Монастырь» с Анастасией Ивлеевой в главной роли и т.д. В 2024 году Любимова заявила о перспективе штрафов и даже закрытия кинотеатров, которые практикуют «предсеансное обслуживание» и показывают голливудские фильмы ушедших из России кинокомпаний.","Комитет Думы поддержал кандидатуру Любимовой на пост главы Минкультуры","12 мая, 16:18"
"Толчок к развитию за этот период получила театральная сфера. Выручка российских театров от продажи билетов на собственные спектакли по итогам 2022 года (последний доступный период официальной статистики Минкультуры) превысила результаты допандемийного 2019-го на 15% и достигла 28,9 млрд против 25,1 млрд руб. Впрочем, в количестве зрителей результаты прошлого года все еще уступали 2019-му на 8%: 31,2 млн против 33,8 млн человек.","Комитет Думы поддержал кандидатуру Любимовой на пост главы Минкультуры","12 мая, 16:18"
"Запуск ракеты, использованной во время атаки на Белгород, где фрагмент «Точки-У» обрушил подъезд жилого дома, был осуществлен из района поселка Казачья Лопань в Харьковской области, сообщает ТАСС со ссылкой на силовые структуры.","ТАСС назвал место пуска ударившей по Белгороду ракеты","12 мая, 16:00"
"«Запуск ракеты, предварительно, осуществлялся с юго-запада, это район Казачьей Лопани», — сказал собеседник агентства.","ТАСС назвал место пуска ударившей по Белгороду ракеты","12 мая, 16:00"
"Минобороны сообщило 12 мая, что Белгород был атакован шестью ракетами «Точка-У», четырьмя реактивными снарядами системы залпового огня (РСЗО) Vampire «Вампир» и двумя реактивными снарядами РСЗО «Ольха». Один из фрагментов сбитых фрагментов «Точки-У» повредил многоквартирный дом.","ТАСС назвал место пуска ударившей по Белгороду ракеты","12 мая, 16:00"
"При обрушении подъезда, по последним данным властей, пострадали 19 человек, среди них есть дети, а также спасатели, прибывшие на разбор завалов, о погибших не сообщалось. Всего во время атаки в Белгороде получили повреждения 62 квартиры в трех многоквартирных домах, а также 11 автомобилей. Также зафиксированы повреждения в поселке Дубовое, селе Таврово к югу от города, селе Стрелецкое к северо-западу и поселке Новосадовый к северо-востоку от столицы региона.","ТАСС назвал место пуска ударившей по Белгороду ракеты","12 мая, 16:00"
"Российские войска ведут наступления в Харьковской области. За прошедшие два дня были взяты под контроль девять населенных пунктов, в том числе несколько сел к востоку от трассы Белгород — Харьков. Казачья Лопань находится к западу от нее.","ТАСС назвал место пуска ударившей по Белгороду ракеты","12 мая, 16:00"
"Главком ВСУ Александр Сырский заявил, что ситуация для украинской армии в Харьковской области «обострилась».","ТАСС назвал место пуска ударившей по Белгороду ракеты","12 мая, 16:00"
"Московский «Локомотив» победил «Оренбург» в матче 28-го тура Российской премьер-лиги (РПЛ).","«Локомотив» победил «Оренбург» благодаря дебютному голу 18-летнего игрока","12 мая, 15:58"
"Игра в Оренбурге завершилась со счетом 0:2. Счет на восьмой минуте с передачи Максима Глушенкова открыл 18-летний Алексей Батраков, который впервые отличился в РПЛ.","«Локомотив» победил «Оренбург» благодаря дебютному голу 18-летнего игрока","12 мая, 15:58"
"Еще один гол в ворота «Оренбурга» на 62-й минуте забил Александр Сильянов, которому также ассистировал Глушенков.","«Локомотив» победил «Оренбург» благодаря дебютному голу 18-летнего игрока","12 мая, 15:58"
"На 49-й минуте защитник гостей Жерзино Ньямси из убойной позиции попал в перекладину.","«Локомотив» победил «Оренбург» благодаря дебютному голу 18-летнего игрока","12 мая, 15:58"
"С 83-й минуты хозяева остались вдесятером после удаления Габриэля Флорентина, который получил вторую желтую карточку.","«Локомотив» победил «Оренбург» благодаря дебютному голу 18-летнего игрока","12 мая, 15:58"
"Глушенков отдал уже 14 голевых передач в этом сезоне, больше было только у Халка в «Зените» (16, сезон 2015/16). При этом восемь из девяти последних ассистов «железнодорожников» в лиге — на счету Глушенкова.","«Локомотив» победил «Оренбург» благодаря дебютному голу 18-летнего игрока","12 мая, 15:58"
"«Локомотив» набрал 47 очков и поднялся на четвертое место в турнирной таблице.","«Локомотив» победил «Оренбург» благодаря дебютному голу 18-летнего игрока","12 мая, 15:58"
"У «Оренбурга» 29 очков и 12-е место.","«Локомотив» победил «Оренбург» благодаря дебютному голу 18-летнего игрока","12 мая, 15:58"
"В следующем туре «Локомотив» сыграет с воронежским «Факелом» 18 мая, а «Оренбург» — с екатеринбургским «Уралом» 19 мая.","«Локомотив» победил «Оренбург» благодаря дебютному голу 18-летнего игрока","12 мая, 15:58"
"О том, что Белгород и Белгородский район подверглись массированному обстрелу со стороны Вооруженных сил Украины (ВСУ), в 11:48 мск 12 мая сообщил губернатор региона Вячеслав Гладков. По его словам, в крупнейшем жилом районе городе «Харьковская гора» в результате попадания снаряда в многоквартирный жилой дом обрушился подъезд с десятого по первый этаж.","Обрушение жилого дома в Белгороде после обстрела. Главное","12 мая, 15:56"
"Минобороны сообщило, что ВСУ около 11:40 мск атаковали Белгород с применением тактического ракетного комплекса (ТРК) «Точка-У», реактивных систем залпового огня (РСЗО) «Ольха» и RM-70 Vampire. По данным ведомства, жилой дом в Белгороде был поврежден фрагментами одной из сбитых ракет «Точка-У».","Обрушение жилого дома в Белгороде после обстрела. Главное","12 мая, 15:56"
